{
  "schemaVersion": "1.0.0",
  "name": "windows-runtime-fixture",
  "profile": "neon-pair",
  "engine": {"minimumVersion": "1.7.0", "maximumVersionExclusive": "1.8.0"},
  "catalogue": "api.json",
  "resources": [{"name": "inventory", "path": "resources/inventory"}],
  "externalDependencies": [],
  "requiredApis": [],
  "unknownApis": "allow"
}
